{
  "name": "DataInsightsApplication",
  "displayName": "Data Insights",
  "appConfiguration": {
    "batchSize": 100,
    "recreateDataAssetsIndex": false,
    "backfillConfiguration": {
        "enabled": false
    }
  },
  "appSchedule": {
    "scheduleTimeline": "Custom",
    "cronExpression": "0 3 * * *"
  }
}