{
  "name": "SearchIndexingApplication",
  "displayName": "Search Indexing",
  "appConfiguration": {
    "entities": [
      "table",
      "dashboard",
      "topic",
      "pipeline",
      "ingestionPipeline",
      "searchIndex",
      "user",
      "team",
      "glossary",
      "glossaryTerm",
      "mlmodel",
      "tag",
      "classification",
      "query",
      "container",
      "database",
      "databaseSchema",
      "testCase",
      "testSuite",
      "chart",
      "dashboardDataModel",
      "databaseService",
      "messagingService",
      "dashboardService",
      "pipelineService",
      "mlmodelService",
      "storageService",
      "metadataService",
      "searchService",
      "entityReportData",
      "webAnalyticEntityViewReportData",
      "webAnalyticUserActivityReportData",
      "domain",
      "storedProcedure",
      "dataProduct",
      "testCaseResolutionStatus",
      "apiService",
      "apiEndpoint",
      "apiCollection"
    ],
    "recreateIndex": false,
    "batchSize": "100",
    "payLoadSize": 104857600,
    "searchIndexMappingLanguage": "EN"
  },
  "appSchedule": {
    "scheduleTimeline": "Custom",
    "cronExpression": "0 0 * * *"
  },
  "supportsInterrupt": true
}
